{
  "help": "(re-)generate rsc/schema/mcp/mcpMessage's latest v*.json from the committed schema.ts alone - every declaration read through the house TypeScript grammar, composed over its extends clauses, tagged by its categories, the declared additions applied - writing the two extracted tables and the consumer and producer faces (the schema flat and open, and flat and closed) under tmp/cache/mcp/; when the derivation differs from the latest version file in any way, prints the diff and mints the next version in place of it (no git; the changelog section is yours, held by the commit gate); idempotent; the dev gate holds the file current and its flattening equal to the witness, upstream's schema.json",
  "args": [],
  "r": [
    "rsc/reference/mcp",
    "rsc/schema/mcp/mcpMessage"
  ],
  "w": [
    "rsc/schema/mcp/mcpMessage",
    "tmp/cache/mcp"
  ]
}
