{
  "help": "remove what the status reads as the store's surplus - what it names, so the verb takes no flag - each duplicate of either species - identical to another unit of its kind, or contained by one by the kind's measure - with what only it feeds, its members, its record and its shadow under tmp/cache, the holder kept; each orphaned shadow, the cache's derivation of a unit the store no longer holds; and each surplus file, a file inside a held unit that its measure does not read, which no capture wrote. The status is re-read beneath the lines",
  "args": [],
  "r": [
    "data/input",
    "tmp/cache",
    "ext/mnt/claude/code/machine-transport",
    "ext/mnt/gemini/code/machine-transport",
    "rsc/provider/providers.csv",
    "rsc/naming/export_archive_members.csv",
    "rsc/cache_io.csv"
  ],
  "consumes": [
    "data/input",
    "tmp/cache"
  ]
}
