{
  "help": "make rpus.co serve the publish tree - copy data/output/site/ into the ext/mnt/site clone, commit there, push - what it would land is corpus-yoga site's status",
  "args": [],
  "sends": {
    "git -C ext/mnt/site push": [
      "WRITES what rpus.co serves (refused loudly under CORPUS_YOGA_NO_SEND)"
    ]
  },
  "r": [
    "data/output/site"
  ],
  "w": [
    "ext/mnt/site"
  ]
}
