{
  "help": "deposit the forge's ledger - issues, pull requests, comments, reviews, labels, blocked_by edges, the repository record - under tmp/stage/input/github/forge/gh-CLI/<stamp>/, one file per read; every run deposits, and a deposit holds only what the forge returned",
  "args": [],
  "sends": {
    "gh api repos/{owner}/{repo}/issues": [
      "reads every issue and pull request, and each issue's blocked_by edges"
    ],
    "gh api repos/{owner}/{repo}/pulls": [
      "reads every pull request, its reviews and review comments"
    ],
    "gh api graphql": [
      "reads every pull request's review count in one paginated query, so only reviewed pulls are read one by one"
    ],
    "gh api repos/{owner}/{repo}/issues/comments": [
      "reads every issue comment"
    ],
    "gh api repos/{owner}/{repo}/labels": [
      "reads the labels"
    ],
    "gh api repos/{owner}/{repo}": [
      "reads the repository record"
    ]
  },
  "w": [
    "tmp/stage/input/github/forge/gh-CLI"
  ]
}
