{
  "help": "promote what corpus-yoga agent capture staged into shared storage: each unit related to the held one of its address (new, identical, extends, ahead, diverged) and, where a family validates it, judged by the verdict corpus-yoga pipeline rehearse cached; copied over the held one where nothing held would be lost, the rest named; the stage is never written",
  "args": [
    {
      "name": "--provider",
      "type": "<provider>",
      "cardinality": "1/agent-promote-1",
      "help": "every unit ONE provider's agent capture staged, or with --id one of them"
    },
    {
      "name": "--id",
      "type": "<prefix>",
      "cardinality": "",
      "help": "one unit of the provider --provider names: a prefix of a component of its address under the provider (a conversation id, a session's uuid, a project's memory) matching exactly one; requires --provider"
    },
    {
      "name": "--all",
      "type": "",
      "cardinality": "1/agent-promote-1",
      "help": "every unit the agent capture staged, every provider"
    },
    {
      "name": "--rehearsal",
      "type": "<stamp>",
      "cardinality": "",
      "help": "the rehearsal whose verdicts are read, by the stamp of its log (default: the newest under tmp/stage/rehearsal); a record's digests refuse a judgement of bytes since recaptured"
    }
  ],
  "r": [
    "tmp/stage/input/claude/code/machine-transport",
    "tmp/stage/input/gemini/code/machine-transport",
    "data/input/claude/code/machine-transport",
    "data/input/gemini/code/machine-transport",
    "tmp/stage/rehearsal"
  ],
  "w": [
    "data/input/claude/code/machine-transport",
    "data/input/gemini/code/machine-transport"
  ],
  "x": [
    "git"
  ]
}
