{
  "help": "re-render each datum's matrix.md from the vN.log files beside it, so the summary agrees with the logs it summarises - every pipeline, or the one named",
  "args": [
    {
      "name": "pipeline",
      "type": "<pipeline>",
      "cardinality": "",
      "help": "one pipeline by name; bare, all of them"
    }
  ],
  "r": [
    "tmp/cache",
    "rsc/schema"
  ],
  "w": [
    "tmp/cache/chat-capture",
    "tmp/cache/chat-export",
    "tmp/cache/code-transport"
  ]
}
