{
  "help": "the Signatures on main against the sessions the store holds: per provider, the sessions main names as drafters and whether each is held, and each message read against its drafter's own record - reports, writes nothing",
  "step": "code-transport",
  "args": [],
  "r": [
    "data/input/claude/code/machine-transport",
    "data/input/gemini/code/machine-transport",
    "rsc/provider/providers.csv"
  ],
  "x": [
    "git"
  ]
}
