{
  "help": "deposit new distinct states and re-render - idempotent (the only write)",
  "args": [],
  "step": "chat-export",
  "r": [
    "tmp/cache/chat-export",
    "rsc/naming/memory_deposit_vintages.csv"
  ],
  "w": [
    "data/output/memories",
    "data/output/markdown/claude/chat/memories"
  ]
}
