{
  "help": "promote what corpus-yoga forge capture staged into shared storage - each unit related to the held one of its address (new, identical, extends, ahead, diverged) and, where a family validates it, judged by the verdict corpus-yoga pipeline rehearse recorded; copied over the held one where nothing held would be lost, the rest named; the stage is never written",
  "args": [],
  "r": [
    "tmp/stage/input/github/forge/gh-CLI",
    "data/input/github/forge/gh-CLI",
    "tmp/stage/rehearsal"
  ],
  "w": [
    "data/input/github/forge/gh-CLI"
  ]
}
