{
  "help": "FREE - render index.html, the corpus page, from the captures + markdown corpus - idempotent",
  "args": [],
  "r": [
    "data/output/markdown",
    "data/output/indexing",
    "rsc/site/index.template.html",
    "data/output/artifacts/claude/chat/downloaded"
  ],
  "w": [
    "tmp/cache/site",
    "data/output/site/index.html"
  ],
  "step": "corpus"
}
