{
  "help": "derive tmp/cache/indexing/candidate-semantic-concepts.txt (the candidates of undisposed concepts, each with the aliases that anchor it in a conversation turn; a concept no turn phrases is named, not queued)",
  "args": [
    {
      "name": "--top",
      "type": "<n>",
      "cardinality": "",
      "help": "also print the frequent-uncovered-corpus-words advisory (top N; terminal only, machine-local)"
    }
  ],
  "r": [
    "data/output/indexing",
    "data/output/markdown"
  ],
  "w": [
    "tmp/cache/indexing"
  ]
}
