{
  "help": "generate every parser that is absent, regenerate every one that differs from what antlr4 generates from its grammar now, and remove what the grammar no longer generates; silent when current (refused loudly under CORPUS_YOGA_NO_SEND)",
  "args": [],
  "r": [
    "rsc/rpus/grammar",
    "src/gen/grammar"
  ],
  "w": [
    "src/gen/grammar"
  ]
}
