{
  "help": "compute supersession — which earlier export dirs are covered (witnessed or deposited); reports, writes nothing",
  "args": [
    {
      "name": "--chat-export-cache",
      "type": "<dir>",
      "cardinality": "",
      "help": "cache root holding <export>/json/ atomised pieces",
      "default": "tmp/cache/chat-export"
    },
    {
      "name": "--bulk-exports",
      "type": "<dir>",
      "cardinality": "",
      "help": "input root holding the raw export dirs (memories/projects/users)",
      "default": "data/input/claude/chat/bulk-export"
    },
    {
      "name": "--api-capture",
      "type": "<dir>",
      "cardinality": "",
      "help": "API-capture root: also compare the latest export against live captures (informational)"
    },
    {
      "name": "--memories-output",
      "type": "<dir>",
      "cardinality": "",
      "help": "the memory deposit store (a deposit is the unconditional licence)",
      "default": "data/output/memories"
    },
    {
      "name": "--summaries-output",
      "type": "<dir>",
      "cardinality": "",
      "help": "the summary deposit store (a deposit is the unconditional licence)",
      "default": "data/output/markdown/claude/chat/summaries"
    }
  ],
  "step": "chat-export",
  "r": [
    "tmp/cache/chat-export",
    "data/input/claude/chat/bulk-export",
    "data/input/claude/chat/API-capture",
    "data/output/memories",
    "data/output/markdown/claude/chat/summaries",
    "rsc/naming/export_dir_vintages.csv"
  ]
}
